{
  "$schema": "https://changesaga.dev/schema/v5/term-revision.schema.json",
  "version": 5,
  "id": "r1",
  "term": "urn:change-saga:app:term:story",
  "parents": [],
  "name": "story",
  "definition": "A sourced user story with explicit acceptance criteria, the traceability backbone of the Saga. Its identity is independent of epic membership, so it can move between epics without breaking a link; its revisions and lifecycle events are append-only.",
  "aliases": [
    "user story"
  ],
  "stories": [
    "urn:change-saga:app:story:durable-epics",
    "urn:change-saga:app:story:traceability-chain"
  ],
  "records": [
    "urn:change-saga:app:term:epic",
    "urn:change-saga:app:term:persona"
  ],
  "code": [
    {
      "commit": "142737451284dd853d7519cfe6e8aedbd25c4668",
      "path": "internal/requirements/model.go",
      "start": 175,
      "end": 187,
      "digest": "sha256:fac2e91d616f7ac6e06aee11d58b8429b3b1aa6c8e161efded353a1ecabb400e"
    }
  ],
  "created_at": "2026-09-19T20:50:33.791647Z"
}
